{
  "schema_version": "1.0",
  "paper_id": "dasgupta2023",
  "citation_key": "Dasgupta2023CrossAttention",
  "doi": "10.48550/arXiv.2310.05395",
  "canonical_url": "https://arxiv.org/abs/2310.05395v1",
  "title": "Robust Image Watermarking based on Cross-Attention and Invariant Domain Learning",
  "authors": [
    "Agnibh Dasgupta",
    "Xin Zhong"
  ],
  "year": 2023,
  "venue": null,
  "access_date": "2026-09-23",
  "source_type": "preprint",
  "verification": "verified",
  "inspected_content": "abstract",
  "inspection": {
    "artifact": "research/literature/inspections/dasgupta2023.md",
    "sha256": "883c10af764c8a9364009362576fddac0a7145767609102758c0422a8a03b19e"
  },
  "limitations": [
    "Local checksum identifies observer notes, not remote full text.",
    "No code inspection or experimental reproduction.",
    "Abstract-only method description; full methods and robustness unverified.",
    "Preprint inspected, not conference full text; no version equivalence asserted."
  ]
}
