{
  "schema_version": "1.0",
  "paper_id": "t7_ringid",
  "citation_key": "T7_ringid_2024",
  "doi": null,
  "canonical_url": "https://www.ecva.net/papers/eccv_2024/papers_ECCV/html/4104_ECCV_2024_paper.php",
  "title": "RingID: Rethinking Tree-Ring Watermarking for Enhanced Multi-Key Identification",
  "authors": [
    "Hai Ci",
    "Pei Yang",
    "Yiren Song",
    "Mike Zheng Shou"
  ],
  "year": 2024,
  "venue": "ECCV",
  "access_date": "2026-10-20",
  "source_type": "paper",
  "verification": "verified",
  "inspected_content": "full-text",
  "inspection": {
    "artifact": "ringid-paper.pdf",
    "sha256": "09a2be633d53dda926f0bae2677fdb6c107f0791375b0fed655e56b52dcb046b"
  },
  "limitations": [
    "Official ECVA title is Rethinking Tree-Ring Watermarking for Enhanced Multi-Key Identification; RingID is the method/paper alias. Main identification averages excluding C&S must be labelled. FID is not equal paired distortion.",
    "V2 means method and evaluation windows inspected; experiments were not reproduced. DOI was not independently verified and remains null."
  ]
}
