{
  "schema_version": "1.0",
  "paper_id": "hunyuan",
  "citation_key": "T2_hunyuan_2024",
  "doi": null,
  "canonical_url": "https://arxiv.org/html/2405.08748v1",
  "title": "Hunyuan-DiT : A Powerful Multi-Resolution Diffusion Transformer with Fine-Grained Chinese Understanding",
  "authors": [
    "Zhimin Li",
    "Jianwei Zhang",
    "Qin Lin",
    "Jiangfeng Xiong",
    "Yanxin Long",
    "Xinchi Deng",
    "Yingfang Zhang",
    "Xingchao Liu",
    "Minbin Huang",
    "Zedong Xiao",
    "Dayou Chen",
    "Jiajun He",
    "Jiahao Li",
    "Wenyue Li",
    "Chen Zhang",
    "Rongwei Quan",
    "Jianxiang Lu",
    "Jiabin Huang",
    "Xiaoyan Yuan",
    "Xiaoxiao Zheng",
    "Yixuan Li",
    "Jihong Zhang",
    "Chao Zhang",
    "Meng Chen",
    "Jie Liu",
    "Zheng Fang",
    "Weiyan Wang",
    "Jinbao Xue",
    "Yangyu Tao",
    "Jianchen Zhu",
    "Kai Liu",
    "Sihuan Lin",
    "Yifu Sun",
    "Yun Li",
    "Dongdong Wang",
    "Mingtao Chen",
    "Zhichao Hu",
    "Xiao Xiao",
    "Yan Chen",
    "Yuhong Liu",
    "Wei Liu",
    "Di Wang",
    "Yong Yang",
    "Jie Jiang",
    "Qinglin Lu"
  ],
  "year": 2024,
  "venue": "arXiv",
  "access_date": "2026-10-20",
  "source_type": "preprint",
  "verification": "verified",
  "inspected_content": "full-text",
  "limitations": [
    "Tencent custom terms, ungated hub; availability is not permissiveness. Native strength wrapper not verified."
  ],
  "inspection": {
    "artifact": "T2-hunyuan-paper.txt",
    "sha256": "69373dd3134bbf703b6acca804648b24cdb7d156296eb5ab7392f14b29f1607a"
  }
}
