{
  "schema_version": "1.0",
  "paper_id": "gaussian-shading",
  "citation_key": "yang2024gaussianshading",
  "doi": null,
  "canonical_url": "https://arxiv.org/html/2404.04956v1",
  "title": "Gaussian Shading: Provable Performance-Lossless Image Watermarking for Diffusion Models",
  "authors": [
    "Zijin Yang",
    "Kai Zeng",
    "Kejiang Chen",
    "Han Fang",
    "Weiming Zhang",
    "Nenghai Yu"
  ],
  "year": 2024,
  "venue": "CVPR 2024",
  "access_date": "2026-10-03",
  "source_type": "paper",
  "verification": "verified",
  "inspected_content": "full-text",
  "inspection": {
    "artifact": "artifacts/gaussian-shading.html",
    "sha256": "90d5175d54883bbe0fa7fd4917eead4122a6e03cf7439ad761c0c5facd50cd11"
  },
  "limitations": [
    "Assumes private diffusion model; stream key management required. Repeated-key or nonce misuse invalidates security reasoning. Reported .4 is sign flip rate, not regeneration strength."
  ]
}
