{
  "schema_version": "1.0",
  "paper_id": "gnri-v5",
  "citation_key": "Samuel2025GNRI",
  "doi": null,
  "canonical_url": "https://arxiv.org/html/2312.12540v5",
  "title": "Lightning-Fast Image Inversion and Editing for Text-to-Image Diffusion Models",
  "authors": [
    "Dvir Samuel",
    "Barak Meiri",
    "Haggai Maron",
    "Yoad Tewel",
    "Nir Darshan",
    "Shai Avidan",
    "Gal Chechik",
    "Rami Ben-Ari"
  ],
  "year": 2025,
  "venue": "ICLR 2025 (inspected arXiv v5)",
  "access_date": "2026-09-27",
  "source_type": "paper",
  "verification": "verified",
  "inspected_content": "full-text",
  "inspection": {
    "artifact": "research/literature/reconstruction-screen-20260927/inspection.md",
    "sha256": "cef3b5b9d44ac9fda6ee9c265833b69261d6877bedd4d5377e8e1d263521cc45"
  },
  "limitations": [
    "Full-text access denotes selected method/results/limitations sections only, not whole-paper verification.",
    "Inspection checksum identifies observer notes; exact downloaded raw HTML checksums and versions are in those notes.",
    "No experimental reproduction, environment adoption or ownership/DCT efficacy evidence."
  ]
}
