{
  "schema_version": "1.0",
  "paper_id": "renoise-v1",
  "citation_key": "Garibi2024ReNoise",
  "doi": null,
  "canonical_url": "https://arxiv.org/html/2403.14602v1",
  "title": "ReNoise: Real Image Inversion Through Iterative Noising",
  "authors": [
    "Daniel Garibi",
    "Or Patashnik",
    "Andrey Voynov",
    "Hadar Averbuch-Elor",
    "Daniel Cohen-Or"
  ],
  "year": 2024,
  "venue": "ECCV 2024",
  "access_date": "2026-09-27",
  "source_type": "paper",
  "verification": "verified",
  "inspected_content": "full-text",
  "inspection": {
    "artifact": "research/literature/inverse-stability-20260927/inspection.md",
    "sha256": "259641e5ef5f1fc0166b6e0a977c038da7e30a68cd5d84764de9c55abc8ae0b2"
  },
  "limitations": [
    "Selected method and appendix passages only, not whole-paper verification.",
    "Notes checksum and raw HTML checksum are distinct.",
    "Different model/schedule profiles; no local reproduction."
  ]
}
